{
  "$schema": "../../schemas/server-metadata.schema.json",
  "id": "github-mrhy7176-cloudgpu-mcp-ae357044",
  "source": {
    "issue": 4683,
    "projectUrl": "https://github.com/mrhy7176/cloudgpu-mcp"
  },
  "links": {
    "endpoint": "https://cloudgpu.app/docs/mcp"
  },
  "install": {
    "commands": [
      "npm: https://www.npmjs.com/package/cloudgpu-mcp"
    ],
    "env": [
      "CLOUDGPU_API_KEY"
    ],
    "confidence": "medium"
  },
  "transport": [
    "stdio"
  ],
  "auth": {
    "type": "api-key",
    "notes": [
      "api-key"
    ]
  },
  "clients": [
    "Claude Code",
    "Cursor",
    "Cline",
    "opencode",
    "goose",
    "VS Code",
    "Windsurf"
  ],
  "license": "MIT"
}
