{
  "$schema": "../../schemas/server-metadata.schema.json",
  "id": "developers-hubspot-com-ai-tools-mcp-beeb6a01",
  "source": {
    "projectUrl": "https://developers.hubspot.com/ai-tools/mcp"
  },
  "links": {
    "endpoint": "https://mcp.hubspot.com/"
  },
  "transport": [
    "streamable-http"
  ],
  "auth": {
    "type": "oauth",
    "notes": [
      "Hosted server signs in with HubSpot through OAuth 2.1; clients without a browser sign-in can't connect."
    ]
  },
  "install": {
    "commands": [],
    "env": [],
    "confidence": "high"
  },
  "verification": {
    "status": "partial",
    "notes": [
      "The hosted endpoint answered an MCP initialize request on 2026-10-22 with HTTP 401 and OAuth protected-resource metadata, so it is live and requires sign-in."
    ]
  }
}
