{
  "$schema": "../../schemas/server-metadata.schema.json",
  "id": "github-sher1096-klinepic-agent-api-examples-e5c2d581",
  "source": {
    "issue": 1176,
    "projectUrl": "https://github.com/sher1096/klinepic-agent-api-examples"
  },
  "description": "Generates annotated candlestick-chart PNGs from broker or exchange fills for post-trade review and visualization without signals, predictions, or order execution.",
  "category": "Finance & Crypto",
  "links": {
    "docs": "https://klinepic.com/guides/trade-review-chart-api/"
  },
  "install": {
    "commands": [
      "npx -y github:sher1096/klinepic-agent-api-examples",
      "docker build -t klinepic-mcp .",
      "docker run --rm -i -e KLINE_AGENT_API_KEY=kline_agent_xxx klinepic-mcp"
    ],
    "env": [
      "KLINE_AGENT_API_KEY"
    ],
    "confidence": "medium"
  },
  "transport": [
    "stdio"
  ],
  "auth": {
    "type": "api-key",
    "notes": [
      "KLINE_AGENT_API_KEY is required for live API calls; the server can start without a key for tool-schema inspection."
    ]
  },
  "clients": [
    "MCP clients that support stdio and environment variables"
  ],
  "tools": {
    "count": 3,
    "names": [
      "klinepic_get_capabilities",
      "klinepic_preflight_review_chart",
      "klinepic_create_review_chart"
    ],
    "source": "self_reported"
  },
  "license": "MIT",
  "verification": {
    "status": "self_reported",
    "notes": [
      "The project README reports successful MCP initialize and tools/list checks with three tools.",
      "Profile claimed by @sher1096 in #1212 under the community profile-claim process."
    ]
  },
  "community": {
    "maintainedBy": [
      "@sher1096"
    ],
    "verifiedBy": [],
    "claimed": true
  }
}
